{
  "$schema": "https://json-schema.org/draft/2020-12/schema",
  "$id": "https://negaccelsimulator.local/schema/negaccel-scan.schema.json",
  "title": "NegAccelSimulator Python scan specification",
  "description": "Python-side scan definition that expands either a user-facing authoring template or a canonical runtime case template into fully resolved case JSON files and can orchestrate simulator runs.",
  "type": "object",
  "additionalProperties": false,
  "required": [
    "metadata",
    "template",
    "scan",
    "outputs"
  ],
  "properties": {
    "metadata": {
      "type": "object",
      "additionalProperties": false,
      "required": [
        "schemaVersion",
        "scanTag"
      ],
      "properties": {
        "schemaVersion": {
          "type": "string",
          "pattern": "^[0-9]+\\.[0-9]+\\.[0-9]+$"
        },
        "scanTag": {
          "type": "string",
          "minLength": 1,
          "description": "Stable scan identifier used in generated case tags and manifest metadata."
        },
        "title": {
          "type": "string"
        },
        "description": {
          "type": "string"
        }
      }
    },
    "template": {
      "type": "object",
      "additionalProperties": false,
      "required": [
        "path"
      ],
      "properties": {
        "kind": {
          "type": "string",
          "enum": [
            "runtime-case",
            "authoring-case"
          ],
          "default": "runtime-case",
          "description": "Select whether template.path points at a canonical runtime case JSON or at the higher-level authoring JSON document."
        },
        "path": {
          "type": "string",
          "minLength": 1,
          "description": "Path to the template JSON document selected by template.kind. Relative paths are resolved from the scan specification file."
        }
      }
    },
    "overrides": {
      "type": "array",
      "description": "Optional overrides applied to every generated case before the scanned value is injected.",
      "items": {
        "$ref": "#/$defs/pathValueOverride"
      }
    },
    "scan": {
      "type": "object",
      "additionalProperties": false,
      "required": [
        "parameterPath",
        "values"
      ],
      "properties": {
        "parameterPath": {
          "type": "string",
          "minLength": 1,
          "description": "Dot path, array-index path, or JSON Pointer of the field to sweep inside the template document selected by template.kind."
        },
        "values": {
          "type": "array",
          "minItems": 1,
          "items": true
        },
        "labels": {
          "type": "array",
          "description": "Optional label for each scan value. When present, it must align one-to-one with scan.values.",
          "items": {
            "type": "string",
            "minLength": 1
          }
        },
        "caseTagTemplate": {
          "type": "string",
          "description": "Optional generated tag template. Supported placeholders: {scan}, {base}, {index}, {label}."
        }
      }
    },
    "outputs": {
      "type": "object",
      "additionalProperties": false,
      "required": [
        "directory"
      ],
      "properties": {
        "directory": {
          "type": "string",
          "minLength": 1,
          "description": "Directory where generated case folders and the scan manifest are written. Relative paths are resolved from the scan specification file."
        },
        "manifestFile": {
          "type": "string",
          "default": "scan-manifest.json"
        }
      }
    },
    "execution": {
      "type": "object",
      "additionalProperties": false,
      "properties": {
        "simulator": {
          "type": "string",
          "description": "Optional simulator executable path used by the Python run-scan command."
        },
        "loadExisting": {
          "type": "boolean"
        },
        "stopOnError": {
          "type": "boolean"
        }
      }
    }
  },
  "$defs": {
    "pathValueOverride": {
      "type": "object",
      "additionalProperties": false,
      "required": [
        "path",
        "value"
      ],
      "properties": {
        "path": {
          "type": "string",
          "minLength": 1
        },
        "value": true
      }
    }
  }
}
